Title,Link
대단히 은밀하고 비밀스러운 랜섬웨어 이미르, 타 조직과 파트너십 맺고 움직여,https://www.boannews.com/media/view.asp?idx=134374&page=1&kind=1
한국영상정보연구조합, 2024년 제3차 업계 협력 네트워킹 데이 개최,https://www.boannews.com/media/view.asp?idx=134370&page=1&kind=3
도청·불법촬영 예방교육센터, 불법촬영 탐지교육 1기 교육 성료,https://www.boannews.com/media/view.asp?idx=134371&page=1&kind=2
블랙프라이데이라는 쇼핑 시즌 노리는 중국 해커, 4천 개 넘는 덫 설치,https://www.boannews.com/media/view.asp?idx=134369&page=1&kind=1
오랜 시간 물밑에서 퍼지고 있는 위협 ‘시팅덕스’, DNS 관리 강화로 예방해야,https://www.boannews.com/media/view.asp?idx=134367&page=1&kind=1
[이슈 인터뷰] AI안전연구소 김명주 초대소장, “안전한 AI 사용 국가 만들 것”,https://www.boannews.com/media/view.asp?idx=134343&page=1&kind=2
2024년 11월 셋째 주, 대기업 및 유망 벤처기업 7곳에서 정보보안 전문가 채용,https://www.boannews.com/media/view.asp?idx=134223&page=1&kind=1
중국의 해킹 그룹, 블랙프레이데이 노리고 가짜 사이트 4700개 운영,https://www.boannews.com/media/view.asp?idx=134364&page=1&kind=1
구글 플레이스토어에서 발견된 악성 앱 9개, 당장 지워야,https://www.boannews.com/media/view.asp?idx=134363&page=1&kind=1
악성 공격에 활용되는 ‘시팅덕스’ 도메인 7만 개 발견돼,https://www.boannews.com/media/view.asp?idx=134362&page=1&kind=1
[인사] 한전KDN, 제14대 박상형 신임 사장 취임,https://www.boannews.com/media/view.asp?idx=134375&page=1&kind=2
모카시스템, 혁신적인 출입통제 기술로 2024 도시·지역혁신대상 행안부 장관상 수상,https://www.boannews.com/media/view.asp?idx=134372&page=1&kind=3
엘림광통신, 초고속 인증 아파트 맞춤형 L2스위치 출시,https://www.boannews.com/media/view.asp?idx=134368&page=1&kind=3
안랩, 임직원 업무 효율성 향상 위해 AI 챗봇 ‘GENIE’ 도입,https://www.boannews.com/media/view.asp?idx=134366&page=1&kind=1
SK쉴더스, HD현대일랙트릭과 글로벌 OT·ICS 보안 경쟁력 강화 나선다,https://www.boannews.com/media/view.asp?idx=134365&page=1&kind=1
중국의 해커들, 미국 통신사 통해 정부 요원들로부터 정보 빼내,https://www.boannews.com/media/view.asp?idx=134361&page=1&kind=1
개인정보보호위원회, 개인정보 정책 4대분야 10대 과제 발표,https://www.boannews.com/media/view.asp?idx=134360&page=1&kind=2
SK C&C, AI DX 기반 ‘디지털 SHE 컨설팅 서비스’로 안전·보건·환경 관리 강화,https://www.boannews.com/media/view.asp?idx=134351&page=1&kind=2
한진, 드론과 스마트 글라스로 미래 물류 혁신 시연회 개최,https://www.boannews.com/media/view.asp?idx=134354&page=1&kind=2
의정부시, 경기도 정보보안 관리실태 평가 2년 연속 우수 시·군 선정,https://www.boannews.com/media/view.asp?idx=134353&page=1&kind=2
교통안전공단, ‘제6회 TS 보안 허점을 찾아라!’ 공모전 개최,https://www.boannews.com/media/view.asp?idx=134352&page=1&kind=2
용인시, 인공지능 기술 활용한 ‘사람길 용인행정 DT로 르네상스 실현’ 사업 청사진 제시,https://www.boannews.com/media/view.asp?idx=134350&page=1&kind=2
AI가 그리는 제조업의 미래: 산업 현장의 목소리를 듣다,https://www.boannews.com/media/view.asp?idx=134349&page=1&kind=2
3차원 디지털 측량 표준화한다,https://www.boannews.com/media/view.asp?idx=134348&page=1&kind=2
국가기술표준원, 양자기술 국제표준 선점 전략 청사진 마련,https://www.boannews.com/media/view.asp?idx=134347&page=1&kind=2
공정위, AI 반도체 관련 기업결합 간담회 개최,https://www.boannews.com/media/view.asp?idx=134346&page=1&kind=2
한번의 유출도 NO! 첨단산업 영업비밀 지켜드립니다,https://www.boannews.com/media/view.asp?idx=134345&page=1&kind=2
농식품부, 정확도 높은 AI 모델로 농산물 가격 예측,https://www.boannews.com/media/view.asp?idx=134344&page=1&kind=2
국정원, 원전 수출 지원 위한 사이버보안 지침 발표,https://www.boannews.com/media/view.asp?idx=134359&page=1&kind=2
지란지교데이터, 대전지역 일자리 창출 공로상 수상,https://www.boannews.com/media/view.asp?idx=134357&page=1&kind=3
아카라라이프, 캐롯손해보험의 주택종합보험 제휴 혜택 제공,https://www.boannews.com/media/view.asp?idx=134356&page=2&kind=3
北 김수키, 최신 공격 사례... RDP Wrapper 악용 및 PebbleDash 악성코드 유포,https://www.boannews.com/media/view.asp?idx=134328&page=2&kind=1
[개인정보 보호법 해석 사례-③] 공공과 민간의 개인정보 처리, 어디까지 허용될까?,https://www.boannews.com/media/view.asp?idx=134268&page=2&kind=2
한국사이버안보학회 기술정책연구위원회, ‘디지털 플랫폼 시대 사이버보안’ 이슈 논의,https://www.boannews.com/media/view.asp?idx=134294&page=2&kind=2
[한국의 사이버 안보전략 토론문-2] 한국 사이버안보전략의 4가지 핵심과제,https://www.boannews.com/media/view.asp?idx=134222&page=2&kind=2
플레인비트 김진국 대표, “암호화폐, 크로스체인 브릿지 활용한 자금 세탁 증가”,https://www.boannews.com/media/view.asp?idx=134295&page=2&kind=3
구글 클라우드 “2025년 사이버 보안 위협, BIG 4 북·중·러·이란 공격 거세질 것”,https://www.boannews.com/media/view.asp?idx=134330&page=2&kind=1
유니온커뮤니티-마일스톤 시스템즈, 공동 파트너 컨퍼런스 성료,https://www.boannews.com/media/view.asp?idx=134329&page=2&kind=3
안랩, ‘디지털포렌식 챌린지 2024’에서 다수 입상,https://www.boannews.com/media/view.asp?idx=134331&page=2&kind=3
와이즈콘, 차세대 통합 주차유도 솔루션 ‘WisePARK’ 출시,https://www.boannews.com/media/view.asp?idx=134324&page=2&kind=3
펜타시큐리티, 두바이에서 중동 사이버보안 시장 진출 본격화,https://www.boannews.com/media/view.asp?idx=134336&page=2&kind=3
MS, 2024년 AI 5대 트렌드 공유... “AI는 글로벌 산업 생산성 강화와 혁신 주도”,https://www.boannews.com/media/view.asp?idx=134338&page=2&kind=3
학생 개인정보 유출한 순천향대·경성대, 과징금 2억 3,580만원 부과,https://www.boannews.com/media/view.asp?idx=134339&page=2&kind=2
관계부처 합동 IP카메라 보안강화 방안 발표 “안전한 IP카메라 이용환경 조성”,https://www.boannews.com/media/view.asp?idx=134341&page=2&kind=2
이지서티 심기창 의장, ‘2024 중소기업 기술·경영 혁신대전’에서 대통령 표창,https://www.boannews.com/media/view.asp?idx=134340&page=2&kind=3
과기정통부, 2024 K-데이터사이언스 컨퍼런스&해커톤 개최,https://www.boannews.com/media/view.asp?idx=134323&page=2&kind=2
과기정통부 장관, 통신3사 대표와 불법 스팸 근절 등 통신현안 논의,https://www.boannews.com/media/view.asp?idx=134318&page=2&kind=2
특허청, 부산대·전북대·제주대 ‘IP중점대학’에서 지식재산 인재 키운다,https://www.boannews.com/media/view.asp?idx=134303&page=2&kind=2
행안부, ‘디지털행정서비스 국민신뢰 제고 대책’ 이행 상황 현장에서 점검한다,https://www.boannews.com/media/view.asp?idx=134305&page=2&kind=2
해수부, 자율주행차의 선박 선적·하역 자동화 기술 시연,https://www.boannews.com/media/view.asp?idx=134306&page=2&kind=2
민·관 협력을 통한 디지털정부 혁신, IT 기업과 함께 논의한다,https://www.boannews.com/media/view.asp?idx=134308&page=3&kind=2
AI 시대 정부혁신 방향, ‘정부박람회’에서 논의한다,https://www.boannews.com/media/view.asp?idx=134307&page=3&kind=2
디자인산업 대전환, 인공지능으로 시동건다,https://www.boannews.com/media/view.asp?idx=134309&page=3&kind=2
LG전자, 환경부와 손잡고 가상현실 안전교육 화학사고 대응 역량 높인다,https://www.boannews.com/media/view.asp?idx=134310&page=3&kind=2
김포시-연세대, 자율교과목 만든다... AI·SW 특화교육도시 ‘성큼’,https://www.boannews.com/media/view.asp?idx=134311&page=3&kind=2
무보, 디지털 혁신으로 무역 사고 예방 이끈다,https://www.boannews.com/media/view.asp?idx=134312&page=3&kind=2
성남시, 정보보안 관리실태 평가 3년 연속 우수기관 선정,https://www.boannews.com/media/view.asp?idx=134314&page=3&kind=2
전남교육청, 쉽고 빠른 보도자료 작성 돕는 ‘전남교육 홍보봇’ 운영,https://www.boannews.com/media/view.asp?idx=134313&page=3&kind=2
GC, 생성형 AI 표준 플랫폼 ‘Hey.GC’ 구축... AI 활용 경쟁력 강화,https://www.boannews.com/media/view.asp?idx=134315&page=3&kind=3
김건 의원 “전 세계에서 논의하는 신흥안보 주제는 AI와 사이버안보”,https://www.boannews.com/media/view.asp?idx=134342&page=3&kind=2
KAIST, 단독 보안 학술대회 ‘Security@KAIST Fair’ 개최,https://www.boannews.com/media/view.asp?idx=134316&page=3&kind=2
IBM, 새로운 과학적 가치와 양자 우위 촉진하는 최첨단 양자 컴퓨터 출시,https://www.boannews.com/media/view.asp?idx=134320&page=3&kind=3
KAIST, 천천히 걸음 속도 높여도 다 아는 인공지능 기술개발,https://www.boannews.com/media/view.asp?idx=134317&page=3&kind=5
[오늘의 보안 영어] come roaring back,https://www.boannews.com/media/view.asp?idx=134335&page=3&kind=1
맥OS 환경에서 멀웨어를 퍼트리는 새로운 기법 발견돼,https://www.boannews.com/media/view.asp?idx=134334&page=3&kind=1
하마스에 친화적인 해킹 그룹, 이스라엘에 삭제형 멀웨어 퍼트려,https://www.boannews.com/media/view.asp?idx=134333&page=3&kind=1
쉬링크로커 랜섬웨어의 복호화 도구 무료로 배포한 비트디펜더,https://www.boannews.com/media/view.asp?idx=134332&page=3&kind=1
사이버안보연구소, 대전대학교 미래복합안보연구소와 업무협약 체결,https://www.boannews.com/media/view.asp?idx=134321&page=3&kind=2
ADT캡스, 올해로 25년째 이어온 수능 당일 ‘수험생 특별 호송 서비스’ 진행,https://www.boannews.com/media/view.asp?idx=134319&page=3&kind=3
포티넷, 2024년 3분기 실적, 전년 동기 대비 13.0% 증가,https://www.boannews.com/media/view.asp?idx=134325&page=3&kind=3
지니언스, 2024 3Q 영업이익 전년比 661% 오른 22억 원 달성,https://www.boannews.com/media/view.asp?idx=134322&page=4&kind=3
이글루코퍼레이션, 제2회 개발자 컨퍼런스 ‘IDC 2024’ 성료,https://www.boannews.com/media/view.asp?idx=134326&page=4&kind=3
금융보안원, ‘SW공급망보안 자율점검 체크리스트’ 개발,https://www.boannews.com/media/view.asp?idx=134327&page=4&kind=2
[한국정보공학기술사 보안을 論하다-8] 비대면 서비스의 편리성과 보안 문제점,https://www.boannews.com/media/view.asp?idx=134282&page=4&kind=6
[bnTV] 美 트럼프 당선에 증시 ‘후끈’ 국내는 ‘찬바람’... AI 관련주는 ‘순항’,https://www.boannews.com/media/view.asp?idx=134300&page=4&kind=3
깃허브에서 활동하는 개발자들을 노리는 고급 피싱 도구, 고이슈,https://www.boannews.com/media/view.asp?idx=134299&page=4&kind=1
호주 벵갈고양이 애호가들을 노리는 굿로더 캠페인,https://www.boannews.com/media/view.asp?idx=134297&page=4&kind=1
SKT ‘양자암호원칩’, 국정원 공식 인정 획득,https://www.boannews.com/media/view.asp?idx=134296&page=4&kind=3
경기남부청, 3,200억원대 가상자산 투자리딩 사기 범죄조직 총책 등 12명 구속,https://www.boannews.com/media/view.asp?idx=134292&page=4&kind=1
모니터랩, 제12회 통합 애플리케이션 보안 세미나 ‘IASF 2024’ 성료,https://www.boannews.com/media/view.asp?idx=134293&page=4&kind=3
해진공, 해운시황정보 AI 음성서비스 ‘KOBC 해운시황 캐스터’ 시범 운영,https://www.boannews.com/media/view.asp?idx=134279&page=4&kind=2
과기정통부·산업부·복지부, ‘제1차 한·영 과학기술혼성위원회’ 개최,https://www.boannews.com/media/view.asp?idx=134275&page=4&kind=2
행안부, ‘2024년 데이터 분석·활용 공모전’ 결선 개최,https://www.boannews.com/media/view.asp?idx=134274&page=4&kind=2
어렵고 복잡한 노동법, 생성형 AI가 쉽게 알려드려요,https://www.boannews.com/media/view.asp?idx=134273&page=4&kind=2
AI 등 디지털 전환에 따른 산업·고용 구조 재편 전망,https://www.boannews.com/media/view.asp?idx=134272&page=4&kind=2
국정원, 民·官 합동 ‘국가 디지털포렌식 워킹데이 2024’ 개최,https://www.boannews.com/media/view.asp?idx=134287&page=4&kind=2
[오늘의 보안 영어] in earnest,https://www.boannews.com/media/view.asp?idx=134291&page=4&kind=1
지원 기간 끝난 디링크 라우터에서 위험한 취약점 3개 발견돼,https://www.boannews.com/media/view.asp?idx=134290&page=4&kind=1
MS의 11월 정기 패치, 91개 취약점 중 4개가 제로데이,https://www.boannews.com/media/view.asp?idx=134289&page=4&kind=1
획기적인 위협이 될 새로운 피싱 도구 고이슈, 깃허브의 개발자들 노려,https://www.boannews.com/media/view.asp?idx=134288&page=4&kind=1
이스라엘 겨냥한 사이버 공격에 신용카드 결제 시스템 일제히 마비돼,https://www.boannews.com/media/view.asp?idx=134286&page=5&kind=1
시흥시, 디지털 저장매체 파기 서비스 무료 제공,https://www.boannews.com/media/view.asp?idx=134280&page=5&kind=2
서울시, 양자컴퓨팅의 현재와 미래 진단한다,https://www.boannews.com/media/view.asp?idx=134278&page=5&kind=2
LG유플러스, 전력 사용 줄이는 6G 네트워크 기술 실증,https://www.boannews.com/media/view.asp?idx=134277&page=5&kind=3
텐스토렌트와 전략적 협업... LG전자, AI 반도체 역량 확 키운다,https://www.boannews.com/media/view.asp?idx=134276&page=5&kind=3
스피어AX, 소방안전 빅데이터 플랫폼 오픈 기념 이벤트 진행,https://www.boannews.com/media/view.asp?idx=134283&page=5&kind=2
IBM 가디엄 데이터 시큐리티 센터 출시... 안전한 AI, 양자내성 고도화,https://www.boannews.com/media/view.asp?idx=134281&page=5&kind=3
스피어AX, ASOCIO Digital Summit서 2년 연속 수상 쾌거,https://www.boannews.com/media/view.asp?idx=134284&page=5&kind=3
경찰청 국가수사본부, ‘2024 안보지킴이 공모전’ 시상식 개최,https://www.boannews.com/media/view.asp?idx=134285&page=5&kind=2
[한국정보보호학회 칼럼] 영화 ‘M3GAN’으로 본 인공지능의 위험성,https://www.boannews.com/media/view.asp?idx=134269&page=5&kind=6
공격자들 사이에서 점점 수요가 높아지는 것, 백신 무력화 도구,https://www.boannews.com/media/view.asp?idx=134271&page=5&kind=1
맥OS 통해 암호화폐 산업 공격하는 북한 해커들, 여전히 진화하기에 부지런해,https://www.boannews.com/media/view.asp?idx=134270&page=5&kind=1
10월 악성코드 통계 분석 결과... 3년간 리눅스 서버 공격한 perfctl 악성코드 발견,https://www.boannews.com/media/view.asp?idx=134248&page=5&kind=1
KISA-중미경제통합은행, 중미 지역 대상 사이버보안 역량 강화 및 지식 공유 협력 추진,https://www.boannews.com/media/view.asp?idx=134267&page=5&kind=2
이지서티, 합성데이터 유용성 측정지표 조사연구 발표,https://www.boannews.com/media/view.asp?idx=134265&page=5&kind=3
TTA, FIDO 얼라이언스 원격 안면인식 규격 국제공인 시험자격 획득,https://www.boannews.com/media/view.asp?idx=134263&page=5&kind=3
한국우주안보학회 변용익 부회장 “우주항공 분야, 규범 회색지대로 법적 해결방안 모색해야”,https://www.boannews.com/media/view.asp?idx=134266&page=5&kind=2
동국대 해양경찰청 연구팀, 재난정보학회서 우수 논문상 수상,https://www.boannews.com/media/view.asp?idx=134264&page=5&kind=2
과기정통부, 부처 협업 통해 디지털트윈 기반 지하공동구 재난관리 플랫폼 구현,https://www.boannews.com/media/view.asp?idx=134261&page=5&kind=2
모니터랩 이광후 대표 “망분리 규제 완화에 초점 맞춰 보안 강화해야”,https://www.boannews.com/media/view.asp?idx=134257&page=5&kind=3