Title,Link
[개인정보 보호법 해석 사례-④] 인사·노무 및 학교의 개인정보 처리 방법은?,https://www.boannews.com/media/view.asp?idx=134541&page=1&kind=2
[정보세계정치학회 칼럼] 데이터·공급망 안보, 신흥위협 대처방안,https://www.boannews.com/media/view.asp?idx=134538&page=1&kind=6
업무 관련 메일로 위장해 유포 중인 악성코드 주의보,https://www.boannews.com/media/view.asp?idx=134530&page=1&kind=3
넘쳐나는 사이버 범죄, 유럽 사이버 범죄 협약 참여 필요성 ‘급부상’,https://www.boannews.com/media/view.asp?idx=134526&page=1&kind=2
테러로부터 안전한 대한민국을 위한 ‘2024 국가대테러발전세미나’ 개최,https://www.boannews.com/media/view.asp?idx=134525&page=1&kind=2
580억원 상당의 가상자산 탈취사건, 북한 해킹그룹 소행으로 드러나,https://www.boannews.com/media/view.asp?idx=134528&page=1&kind=1
거실에서 스마트 TV를 보는 건 우리와 우리 가족만이 아니다,https://www.boannews.com/media/view.asp?idx=133428&page=1&kind=4
과기정통부, 제2회 아세안사이버쉴드 해킹방어대회 11월 19~22일 개최,https://www.boannews.com/media/view.asp?idx=134474&page=1&kind=2
최고의 ‘보안 강연자’를 선발하다... ISEC 2024 ‘Best Speaker Award’ 시상식 개최,https://www.boannews.com/media/view.asp?idx=134495&page=1&kind=3
개인정보 유출 사고 대응방안 논의... 공공·민간 협력의 현주소는?,https://www.boannews.com/media/view.asp?idx=134496&page=1&kind=2
LG유플러스, 신임 CEO로 홍범식 사장 선임... IT 전문가이자 전략가,https://www.boannews.com/media/view.asp?idx=134543&page=1&kind=3
LG CNS, 2025년 정기 임원인사 실시... 헌신균 대표, 사장 승진,https://www.boannews.com/media/view.asp?idx=134542&page=1&kind=3
인터엠, ‘저지연 네트워크 오디오 앰프’로 IR52 장영실상 수상,https://www.boannews.com/media/view.asp?idx=134537&page=1&kind=3
AI 시대의 개인정보보호, 체계적인 리스크 평가·관리 방안 모색,https://www.boannews.com/media/view.asp?idx=134536&page=1&kind=2
벨로크, 2024 파트너스 데이 성료... 협력사와의 파트너십 강화,https://www.boannews.com/media/view.asp?idx=134535&page=1&kind=3
한국요꼬가와, 11월 27일 OT 보안을 위한 웨비나 개최,https://www.boannews.com/media/view.asp?idx=134532&page=1&kind=3
슈프리마, 몰타에서 글로벌 AI 통합 보안 솔루션 기업 선언,https://www.boannews.com/media/view.asp?idx=134534&page=1&kind=3
S2W, 도메인 특화 LLM으로 AI 혁신 이끌어... “분야별 맞춤형 언어 모델, AI 경쟁력 높인다”,https://www.boannews.com/media/view.asp?idx=134533&page=1&kind=3
쿼리파이, 올해의 ‘탑 100 소프트웨어 기업’ 선정,https://www.boannews.com/media/view.asp?idx=134531&page=1&kind=3
X-ray 수화물 검색기 제조사 엠아이케이스캔, ‘차세대 세계일류상품’으로 선정,https://www.boannews.com/media/view.asp?idx=134529&page=1&kind=3
티피링크 Omada, 양쪽에 25G SFP28 커넥터 탑재한 일체형 DAC 광 모듈 케이블 출시,https://www.boannews.com/media/view.asp?idx=134527&page=1&kind=3
KISA, 빛가람혁신도시 공공기관 간 인적자원개발 협력 강화,https://www.boannews.com/media/view.asp?idx=134524&page=1&kind=2
사이버리즌, 글로벌 EDR 솔루션 한국어 버전 출시,https://www.boannews.com/media/view.asp?idx=134523&page=1&kind=3
HS효성인포메이션시스템, 연세의료원 ‘차세대 PACS 시스템’ 구축,https://www.boannews.com/media/view.asp?idx=134522&page=1&kind=3
포티넷, 솔루션에 생성형 AI 어시스턴트 ‘FortiAI’ 통합,https://www.boannews.com/media/view.asp?idx=134521&page=1&kind=3
과기정통부, ‘OECD 디지털경제전망보고서 2024 2권’ 발간,https://www.boannews.com/media/view.asp?idx=134499&page=1&kind=2
조달청, 혁신제품 지정 A~Z까지 맞춤형 설명회 개최,https://www.boannews.com/media/view.asp?idx=134500&page=1&kind=2
중기부, ‘2024 올해의 SNS’ 정부부처 인스타그램 부문 최우수상 수상,https://www.boannews.com/media/view.asp?idx=134501&page=1&kind=2
고용정보원-진로교육학회, AI 시대 진로교육 혁신 방안 마련 학술대회 공동 개최,https://www.boannews.com/media/view.asp?idx=134502&page=1&kind=2
방산 강국 목표 달성 위해 소·부·장 개발에 힘쓴다,https://www.boannews.com/media/view.asp?idx=134503&page=1&kind=2
노르웨이 선급협회 DNV, 해운 사이버 보안 보고서 발간,https://www.boannews.com/media/view.asp?idx=134519&page=2&kind=3
2024 ESG Practice 콘퍼런스 개최... ESG 실천, 대한민국 해법 모색,https://www.boannews.com/media/view.asp?idx=134520&page=2&kind=3
K-디지털 트레이닝과 함께 상상을 현실로!,https://www.boannews.com/media/view.asp?idx=134504&page=2&kind=2
과학기술 기반 디지털 전환 선도... 산림 분야 성장동력 창출한다,https://www.boannews.com/media/view.asp?idx=134505&page=2&kind=2
민간 첨단기술 국방 분야 이어달리기, ‘제2회 미래 국방 기술교류회’ 개최,https://www.boannews.com/media/view.asp?idx=134507&page=2&kind=2
조달청·한국도로공사, 혁신제품 ‘해외 진출’ 지원한다,https://www.boannews.com/media/view.asp?idx=134508&page=2&kind=2
올해 네 번째 레디 코리아 훈련, 아파트 전기차 화재 범정부 대응체계 점검,https://www.boannews.com/media/view.asp?idx=134509&page=2&kind=2
SKT, 저궤도 위성 기반 재난 통신 기술로 전파방송기술대상 장관상 수상,https://www.boannews.com/media/view.asp?idx=134510&page=2&kind=3
SK쉴더스, 랜섬웨어 동향 분석 보고서 2종 발간,https://www.boannews.com/media/view.asp?idx=134518&page=2&kind=3
LG전자, 산업전시회에서 빠르고 안정적인 이음5G 기술 첫선,https://www.boannews.com/media/view.asp?idx=134511&page=2&kind=3
연세대, 2024 바른ICT연구소 리서치 콘퍼런스 성료,https://www.boannews.com/media/view.asp?idx=134513&page=2&kind=2
연세대 인공지능융합대학 실험실 창업기업 ‘미타운’, CES 2025 혁신상 수상,https://www.boannews.com/media/view.asp?idx=134514&page=2&kind=2
삼성전기, 차량용 카메라 소프트웨어 글로벌 인증 오토모티브 스파이스 레벨 3 획득,https://www.boannews.com/media/view.asp?idx=134515&page=2&kind=3
MS의 로우코드 플랫폼 파워페이지스, 사용자들의 보안 인식 제고 필요해,https://www.boannews.com/media/view.asp?idx=134494&page=2&kind=1
북한 IT노동자, 가짜 이력서로 서방국 취업해 정보탈취·외화벌이 ‘일거양득’,https://www.boannews.com/media/view.asp?idx=134485&page=2&kind=1
개인정보위, 민간과 공동으로 개인정보 보호와 데이터 활용 생태계 조성 방법 찾는다,https://www.boannews.com/media/view.asp?idx=134488&page=2&kind=2
SKT, 신한카드와 AI 기반 사이버금융 범죄 예방 맞손,https://www.boannews.com/media/view.asp?idx=134487&page=2&kind=3
경찰청, 제17회 사이버치안대상 시상식 개최... 김휘강 고려대 교수 대통령 표창,https://www.boannews.com/media/view.asp?idx=134486&page=2&kind=2
트럼프 당선에 일론 머스크 부상까지... AI 시대의 사이버안보 전략 9가지,https://www.boannews.com/media/view.asp?idx=134408&page=2&kind=2
[오늘의 보안 영어] on the spot,https://www.boannews.com/media/view.asp?idx=134493&page=2&kind=1
데이터 분석과 데이터 과학에 널리 사용되는 플랫폼, 스포츠 경기 노려,https://www.boannews.com/media/view.asp?idx=134492&page=3&kind=1
러시아 랜섬웨어 포보스의 운영자, 한국에서 미국으로 인도돼,https://www.boannews.com/media/view.asp?idx=134491&page=3&kind=1
악명 높은 봇넷 엔지오웹, 각종 범죄 인프라 확대시키고 있어,https://www.boannews.com/media/view.asp?idx=134490&page=3&kind=1
애플, 올해 다섯 번째와 여섯 번째 발견된 제로데이 취약점 패치,https://www.boannews.com/media/view.asp?idx=134489&page=3&kind=1
티피링크 Festa, Wi-Fi 7 천장형 AP 신제품 출시,https://www.boannews.com/media/view.asp?idx=134484&page=3&kind=3
NSHC, 일본 ‘EdgeTech+ 2024’ 초청받아 한국기업으로 참가중,https://www.boannews.com/media/view.asp?idx=134483&page=3&kind=3
관세청, ‘2024 정부혁신 왕중왕전’ 장관상 수상,https://www.boannews.com/media/view.asp?idx=134458&page=3&kind=2
지역 문제를 신기술로 해결... ‘데이터 기반 지역활성화 사업’ 성과공유회 개최,https://www.boannews.com/media/view.asp?idx=134457&page=3&kind=2
자율운항선박 자동 정박 시스템, ‘대한민국 올해의 10대 기계 기술’ 선정,https://www.boannews.com/media/view.asp?idx=134456&page=3&kind=2
특허청, ‘2024 캠퍼스 특허 유니버시아드’ 시상식 개최,https://www.boannews.com/media/view.asp?idx=134455&page=3&kind=2
스마트건설로 미래를 디자인하다... 국토부, ‘2024 스마트건설 EXPO’ 개막,https://www.boannews.com/media/view.asp?idx=134454&page=3&kind=2
중기부, ‘2024 민관협력 오픈이노베이션’ 성과공유회 개최,https://www.boannews.com/media/view.asp?idx=134453&page=3&kind=2
SKT AI 펠로우십 6기, 특허 출원·서비스화 등 눈부신 성과 창출,https://www.boannews.com/media/view.asp?idx=134452&page=3&kind=2
ETRI, 전문 분야 설명가능한 인공지능 기술개발,https://www.boannews.com/media/view.asp?idx=134451&page=3&kind=2
GIST AI정책전략대학원, 아마존웹서비스와 클라우드 인재 양성에 힘 모아,https://www.boannews.com/media/view.asp?idx=134450&page=3&kind=2
과기정통부, 딥페이크 주제로 ‘디지털 심화쟁점 공동토의’ 개최,https://www.boannews.com/media/view.asp?idx=134476&page=3&kind=2
연말시즌, 해커도 성수기... 해커들이 만든 가짜 쇼핑몰 방문 35% 증가,https://www.boannews.com/media/view.asp?idx=134475&page=3&kind=1
현대오토에버 인공지능기술팀, 국제표준 인증 획득,https://www.boannews.com/media/view.asp?idx=134478&page=3&kind=3
연세대, IBM과 함께 양자컴퓨터 ‘IBM 퀀텀 시스템 원’ 국내 최초 공개,https://www.boannews.com/media/view.asp?idx=134479&page=3&kind=3
앤앤에스피 “K-방산 지속 성장 위해 ‘사이버 보안’ 강화 필수”,https://www.boannews.com/media/view.asp?idx=134482&page=3&kind=3
국내 대학 매크로 공격 비율 44%... 비수강신청 기간도 25%,https://www.boannews.com/media/view.asp?idx=134481&page=4&kind=3
데이터브릭스, 금융보안원 CSP 안전성 평가 완료,https://www.boannews.com/media/view.asp?idx=134480&page=4&kind=3
파수, ‘파수 엔터프라이즈 디알엠’ 신버전 출시,https://www.boannews.com/media/view.asp?idx=134477&page=4&kind=3
과기정통부, 2024년 ‘사이버보안 정책 포럼’ 워크숍 개최,https://www.boannews.com/media/view.asp?idx=134467&page=4&kind=2
파주시, 경기도 시군 정보보안 관리실태 평가서 4년 연속 ‘최우수 등급’ 달성,https://www.boannews.com/media/view.asp?idx=134449&page=4&kind=2
하나증권, 업계 최초 AI명함 도입,https://www.boannews.com/media/view.asp?idx=134448&page=4&kind=3
동해시, AI를 통한 적극행정 실현,https://www.boannews.com/media/view.asp?idx=134447&page=4&kind=2
[bnTV] 국내 주식시장, 외국인 거침없는 ‘팔자’에 ‘블랙먼데이’ 공포 재현됐다,https://www.boannews.com/media/view.asp?idx=134466&page=4&kind=3
마이크로소프트 이그나이트 2024 개막 “AI 에이전트 시대 연다”,https://www.boannews.com/media/view.asp?idx=134473&page=4&kind=3
TTA, 제6차 메타버스 표준포럼 합동 교류회 21일 개최,https://www.boannews.com/media/view.asp?idx=134472&page=4&kind=2
헥사곤-프라운호퍼 연구소, 새로운 전기화학 시뮬레이션 솔루션 출시,https://www.boannews.com/media/view.asp?idx=134471&page=4&kind=3
인텔리빅스, 화성시에 전국 최대 AI 영상관제 시스템 완성,https://www.boannews.com/media/view.asp?idx=134470&page=4&kind=2
스틸리언 ‘앱수트 MacroBlock’, GS인증 1등급 획득,https://www.boannews.com/media/view.asp?idx=134469&page=4&kind=3
[인사] 프루프포인트, JP 유 SAK 총괄 부사장 선임,https://www.boannews.com/media/view.asp?idx=134468&page=4&kind=3
[신간] 스마트도시 통합운영센터! 효율적 운영? 나도 할 수 있다(I can do it) 출간,https://www.boannews.com/media/view.asp?idx=134465&page=4&kind=3
금융보안원, ‘실전형 침해대응 훈련 플랫폼’ 구축... 2025년 정식 오픈,https://www.boannews.com/media/view.asp?idx=134464&page=4&kind=2
개인정보위, 동등성 인정 평가를 위한 국외이전 전문위원회 개최,https://www.boannews.com/media/view.asp?idx=134463&page=4&kind=2
[이슈칼럼] 진화하는 자동차, 그리고 사이버보안의 ‘미래’,https://www.boannews.com/media/view.asp?idx=134439&page=4&kind=5
위드앤아이티, ‘2024 큐샌 파트너스데이’ 성료,https://www.boannews.com/media/view.asp?idx=134462&page=4&kind=3
LG유플러스, ‘듀얼넘버 온앤오프’로 개인정보 보호 및 보이스피싱 예방한다,https://www.boannews.com/media/view.asp?idx=134459&page=4&kind=3
이글루코퍼레이션, 아스트론시큐리티와 전략적 지분 투자 협약 체결,https://www.boannews.com/media/view.asp?idx=134460&page=5&kind=3
넷앤드, 인도네시아 대학생 기업 특강 성료... 글로벌 정보보안 인재 양성 지원,https://www.boannews.com/media/view.asp?idx=134461&page=5&kind=3
[긴급] 레디스 DB 시스템에서 원격 코드 실행 취약점 발견... 소규모 기업 주의,https://www.boannews.com/media/view.asp?idx=134444&page=5&kind=1
K-조달에 반한 UAE 아부다비 정부역량강화부, 공공조달 정책 발전 논의,https://www.boannews.com/media/view.asp?idx=134445&page=5&kind=2
유니온커뮤니티, ‘제4회 스마트금융 대상’ 금융보안원장상 수상,https://www.boannews.com/media/view.asp?idx=134446&page=5&kind=3
과기정통부, 제1회 자율주행 인공지능 챌린지 시상식 개최,https://www.boannews.com/media/view.asp?idx=134443&page=5&kind=2
경찰청, 딥페이크 등 디지털 성범죄 대응 위한 ‘글로벌 정책 대화’ 개최,https://www.boannews.com/media/view.asp?idx=134442&page=5&kind=2
제140차 CISO포럼, 보안사고 이후 거버넌스 변화 및 부서별 보안교육 노하우 공유,https://www.boannews.com/media/view.asp?idx=134431&page=5&kind=3
쿼드마이너, 구 버전 개발 테스트용 소스코드 유출...  “기존 고객 및 현재 버전에 영향 없어”,https://www.boannews.com/media/view.asp?idx=134386&page=5&kind=1
경찰청, 19개 국가·국제기구 참여 ‘제2회 사기방지 국제 콘퍼런스’ 개최,https://www.boannews.com/media/view.asp?idx=134441&page=5&kind=2
[단독] 랜섬웨어 조직 RA그룹, SK가스의 직원 개인정보 및 부서별 데이터 등 700GB 탈취 주장,https://www.boannews.com/media/view.asp?idx=134391&page=5&kind=1
이스트시큐리티, 캐릭터 IP 신규사업 ‘이스트로바’ 본격 시동,https://www.boannews.com/media/view.asp?idx=134440&page=5&kind=1
아카마이, 클라우드 관여 없이 바로 실행 가능한 애플리케이션 플랫폼 출시,https://www.boannews.com/media/view.asp?idx=134438&page=5&kind=3
씨큐비스타 “중소기업, 전체 사이버 공격의 83% 차지... 보안 위험 수위 한계 넘어”,https://www.boannews.com/media/view.asp?idx=134437&page=5&kind=3
지란지교에스앤씨, 시스템 취약점 자동 점검 솔루션 VADA v4.0 메이저 업그레이드,https://www.boannews.com/media/view.asp?idx=134430&page=5&kind=3
S2W, ‘시큐리티 가드레일’ 적용한 기업용 생성형 AI 플랫폼 제공,https://www.boannews.com/media/view.asp?idx=134429&page=5&kind=3
KISA, ‘그놈 목소리’를 학습한 AI로 보이스피싱 예방!,https://www.boannews.com/media/view.asp?idx=134428&page=5&kind=2
[한국의 사이버 안보전략 토론문-4] 언론이 바라본 한국 사이버안보 현황과 과제,https://www.boannews.com/media/view.asp?idx=134403&page=5&kind=6
[오늘의 보안 영어] against the backdrop,https://www.boannews.com/media/view.asp?idx=134436&page=5&kind=1
페이스북의 멀버타이징 캠페인, 비트워든 최신판 위장해 사람들 속여,https://www.boannews.com/media/view.asp?idx=134435&page=5&kind=1